[
  {
    "datasetId": "gse277292_dapp1",
    "methodId": "LAIOR",
    "metricId": "nmi",
    "rawValue": 0.546,
    "provenance": {
      "paperId": "LAIOR",
      "locator": "Fig. 8 WTKO table",
      "datasetVersion": "GSE277292",
      "methodVersion": "0.0.0-author",
      "runConfigId": "laior-fig8-reserved-geo",
      "extractedAt": "2026-08-26T00:00:00Z"
    }
  },
  {
    "datasetId": "gse278673_radiation",
    "methodId": "LAIOR",
    "metricId": "ari",
    "rawValue": 0.691,
    "provenance": {
      "paperId": "LAIOR",
      "locator": "Fig. 8 IRALL table",
      "datasetVersion": "GSE278673",
      "methodVersion": "0.0.0-author",
      "runConfigId": "laior-fig8-reserved-geo",
      "extractedAt": "2026-08-26T00:00:00Z"
    }
  },
  {
    "datasetId": "gse278673_radiation",
    "methodId": "LAIOR",
    "metricId": "calinski_harabasz",
    "rawValue": 5125,
    "provenance": {
      "paperId": "LAIOR",
      "locator": "Fig. 8 IRALL table",
      "datasetVersion": "GSE278673",
      "methodVersion": "0.0.0-author",
      "runConfigId": "laior-fig8-reserved-geo",
      "extractedAt": "2026-08-26T00:00:00Z"
    }
  },
  {
    "datasetId": "gse278673_radiation",
    "methodId": "LAIOR",
    "metricId": "laior_coupling",
    "rawValue": 0.557,
    "provenance": {
      "paperId": "LAIOR",
      "locator": "Fig. 8 IRALL table",
      "datasetVersion": "GSE278673",
      "methodVersion": "0.0.0-author",
      "runConfigId": "laior-fig8-reserved-geo",
      "extractedAt": "2026-08-26T00:00:00Z"
    }
  },
  {
    "datasetId": "gse278673_radiation",
    "methodId": "LAIOR",
    "metricId": "nmi",
    "rawValue": 0.693,
    "provenance": {
      "paperId": "LAIOR",
      "locator": "Fig. 8 IRALL table",
      "datasetVersion": "GSE278673",
      "methodVersion": "0.0.0-author",
      "runConfigId": "laior-fig8-reserved-geo",
      "extractedAt": "2026-08-26T00:00:00Z"
    }
  }
]
